"No.","Time","Source","Destination","Protocol","Length","Info"
"1","0.000000","23.219.184.35","192.168.43.93","TCP","66","80  >  52758 [ACK] Seq=1 Ack=1 Win=262 Len=0 SLE=0 SRE=1"
"2","0.000210","23.219.184.16","192.168.43.93","TCP","66","80  >  52759 [ACK] Seq=1 Ack=1 Win=245 Len=0 SLE=0 SRE=1"
"3","3.133103","192.168.43.93","204.246.164.117","TCP","55","52798  >  443 [ACK] Seq=1 Ack=1 Win=258 Len=1 [TCP segment of a reassembled PDU]"
"4","3.231357","204.246.164.117","192.168.43.93","TCP","66","443  >  52798 [ACK] Seq=1 Ack=2 Win=123 Len=0 SLE=1 SRE=2"
"5","3.935824","192.168.43.93","117.18.237.29","TCP","55","52800  >  80 [ACK] Seq=1 Ack=1 Win=255 Len=1"
"6","4.127828","117.18.237.29","192.168.43.93","TCP","66","80  >  52800 [ACK] Seq=1 Ack=2 Win=131 Len=0 SLE=1 SRE=2"
"7","6.077986","192.168.43.93","69.171.250.60","TLSv1.2","93","Application Data"
"8","6.200371","69.171.250.60","192.168.43.93","TLSv1.2","93","Application Data"
"9","6.242211","192.168.43.93","69.171.250.60","TCP","54","52764  >  443 [ACK] Seq=40 Ack=40 Win=255 Len=0"
"10","6.980791","192.168.43.93","69.171.250.60","TLSv1.2","85","Application Data"
"11","7.614049","192.168.43.93","69.171.250.60","TCP","85","[TCP Retransmission] 52766  >  443 [PSH, ACK] Seq=1 Ack=1 Win=2077 Len=31"
"12","8.367189","69.171.250.60","192.168.43.93","TCP","54","443  >  52766 [ACK] Seq=1 Ack=32 Win=260 Len=0"
"13","8.444861","192.168.43.93","117.18.232.240","TCP","54","52793  >  80 [FIN, ACK] Seq=1 Ack=1 Win=257 Len=0"
"14","8.445064","192.168.43.93","117.18.232.240","TCP","54","52795  >  80 [FIN, ACK] Seq=1 Ack=1 Win=256 Len=0"
"15","8.568431","69.171.250.60","192.168.43.93","TLSv1.2","92","Application Data"
"16","8.609481","192.168.43.93","69.171.250.60","TCP","54","52766  >  443 [ACK] Seq=32 Ack=39 Win=2077 Len=0"
"17","8.768459","117.18.232.240","192.168.43.93","TCP","54","80  >  52793 [FIN, ACK] Seq=1 Ack=2 Win=131 Len=0"
"18","8.768575","192.168.43.93","117.18.232.240","TCP","54","52793  >  80 [ACK] Seq=2 Ack=2 Win=257 Len=0"
"19","8.841031","69.171.250.60","192.168.43.93","TLSv1.2","92","[TCP Spurious Retransmission] , Application Data"
"20","8.841132","192.168.43.93","69.171.250.60","TCP","66","[TCP Dup ACK 16#1] 52766  >  443 [ACK] Seq=32 Ack=39 Win=2077 Len=0 SLE=1 SRE=39"
"21","8.861322","117.18.232.240","192.168.43.93","TCP","54","80  >  52795 [ACK] Seq=0 Ack=1 Win=133 Len=0"
"22","8.861416","192.168.43.93","117.18.232.240","TCP","54","[TCP Dup ACK 14#1] [TCP ACKed unseen segment] 52795  >  80 [ACK] Seq=2 Ack=1 Win=256 Len=0"
"23","8.909622","117.18.232.240","192.168.43.93","TCP","54","[TCP Previous segment not captured] 80  >  52795 [FIN, ACK] Seq=1 Ack=2 Win=133 Len=0"
"24","8.909742","192.168.43.93","117.18.232.240","TCP","54","[TCP ACKed unseen segment] 52795  >  80 [ACK] Seq=2 Ack=2 Win=256 Len=0"
"25","10.000378","192.168.43.93","23.219.184.35","TCP","55","[TCP Spurious Retransmission] 52758  >  80 [ACK] Seq=0 Ack=1 Win=258 Len=1"
"26","10.000543","192.168.43.93","23.219.184.16","TCP","55","[TCP Spurious Retransmission] 52759  >  80 [ACK] Seq=0 Ack=1 Win=255 Len=1"
"27","10.473322","23.219.184.35","192.168.43.93","TCP","66","[TCP Dup ACK 1#1] 80  >  52758 [ACK] Seq=1 Ack=1 Win=262 Len=0 SLE=0 SRE=1"
"28","10.499516","23.219.184.16","192.168.43.93","TCP","66","[TCP Dup ACK 2#1] 80  >  52759 [ACK] Seq=1 Ack=1 Win=245 Len=0 SLE=0 SRE=1"
"29","11.379938","RealmeCh_44:52:99","HonHaiPr_22:9d:1b","ARP","42","Who has 192.168.43.93? Tell 192.168.43.1"
"30","11.379978","HonHaiPr_22:9d:1b","RealmeCh_44:52:99","ARP","42","192.168.43.93 is at 9c:30:5b:22:9d:1b"
"31","13.236447","192.168.43.93","204.246.164.117","TCP","55","[TCP Keep-Alive] 52798  >  443 [ACK] Seq=1 Ack=1 Win=258 Len=1"
"32","14.025412","192.168.43.93","192.168.43.1","DNS","89","Standard query 0xcfaa A v10.events.data.microsoft.com"
"33","14.129042","192.168.43.93","117.18.237.29","TCP","55","[TCP Keep-Alive] 52800  >  80 [ACK] Seq=1 Ack=1 Win=255 Len=1"
"34","14.212996","192.168.43.93","192.168.43.1","DNS","89","Standard query 0xcfaa A v10.events.data.microsoft.com"
"35","14.236891","192.168.43.93","204.246.164.117","TCP","55","[TCP Keep-Alive] 52798  >  443 [ACK] Seq=1 Ack=1 Win=258 Len=1"
"36","14.640521","192.168.43.1","192.168.43.93","DNS","207","Standard query response 0xcfaa A v10.events.data.microsoft.com CNAME global.asimov.events.data.trafficmanager.net CNAME skypedataprdcoluks04.cloudapp.net A 52.114.88.28"
"37","14.641998","192.168.43.93","52.114.88.28","TCP","66","52804  >  443 [SYN] Seq=0 Win=64240 Len=0 MSS=1460 WS=256 SACK_PERM=1"
"38","14.928771","192.168.43.93","192.168.43.1","DNS","85","Standard query 0x0ed0 A push.services.mozilla.com"
"39","15.073304","117.18.237.29","192.168.43.93","TCP","66","[TCP Keep-Alive ACK] 80  >  52800 [ACK] Seq=1 Ack=2 Win=131 Len=0 SLE=1 SRE=2"
"40","15.116791","192.168.43.93","192.168.43.1","DNS","85","Standard query 0x0ed0 A push.services.mozilla.com"
"41","15.237314","192.168.43.93","204.246.164.117","TCP","55","[TCP Keep-Alive] 52798  >  443 [ACK] Seq=1 Ack=1 Win=258 Len=1"
"42","15.520052","204.246.164.117","192.168.43.93","TCP","66","[TCP Keep-Alive ACK] 443  >  52798 [ACK] Seq=1 Ack=2 Win=123 Len=0 SLE=1 SRE=2"
"43","15.642681","192.168.43.93","52.114.88.28","TCP","66","[TCP Retransmission] 52804  >  443 [SYN] Seq=0 Win=64240 Len=0 MSS=1460 WS=256 SACK_PERM=1"
"44","15.725755","192.168.43.1","192.168.43.93","DNS","139","Standard query response 0x0ed0 A push.services.mozilla.com CNAME autopush.prod.mozaws.net A 52.35.85.60"
"45","15.728395","192.168.43.93","192.168.43.1","DNS","84","Standard query 0x66b1 A autopush.prod.mozaws.net"
"46","15.732754","192.168.43.1","192.168.43.93","DNS","100","Standard query response 0x66b1 A autopush.prod.mozaws.net A 52.35.85.60"
"47","15.736273","192.168.43.93","52.35.85.60","TCP","66","52805  >  443 [SYN] Seq=0 Win=64240 Len=0 MSS=1460 WS=256 SACK_PERM=1"
"48","15.738394","192.168.43.93","192.168.43.1","DNS","84","Standard query 0x34fb AAAA autopush.prod.mozaws.net"
"49","15.848245","52.114.88.28","192.168.43.93","TCP","66","443  >  52804 [SYN, ACK] Seq=0 Ack=1 Win=8192 Len=0 MSS=1380 WS=256 SACK_PERM=1"
"50","15.848447","192.168.43.93","52.114.88.28","TCP","54","52804  >  443 [ACK] Seq=1 Ack=1 Win=66048 Len=0"
"51","15.849782","192.168.43.93","52.114.88.28","TLSv1.2","262","Client Hello"
"52","15.926312","192.168.43.93","192.168.43.1","DNS","84","Standard query 0x34fb AAAA autopush.prod.mozaws.net"
"53","16.010270","192.168.43.93","52.35.85.60","TCP","66","52806  >  443 [SYN] Seq=0 Win=64240 Len=0 MSS=1460 WS=256 SACK_PERM=1"
"54","16.374869","52.114.88.28","192.168.43.93","TCP","66","[TCP Retransmission] 443  >  52804 [SYN, ACK] Seq=0 Ack=1 Win=8192 Len=0 MSS=1380 WS=256 SACK_PERM=1"
"55","16.375030","192.168.43.93","52.114.88.28","TCP","66","[TCP Dup ACK 50#1] 52804  >  443 [ACK] Seq=209 Ack=1 Win=66048 Len=0 SLE=0 SRE=1"
"56","16.375692","204.246.164.117","192.168.43.93","TCP","66","[TCP Keep-Alive ACK] 443  >  52798 [ACK] Seq=1 Ack=2 Win=123 Len=0 SLE=1 SRE=2"
"57","16.392631","52.114.88.28","192.168.43.93","TCP","54","[TCP Window Update] 443  >  52804 [ACK] Seq=1 Ack=1 Win=8192 Len=0"
"58","16.392631","192.168.43.1","192.168.43.93","DNS","169","Standard query response 0x34fb AAAA autopush.prod.mozaws.net SOA ns-1260.awsdns-29.org"
"59","16.417455","204.246.164.117","192.168.43.93","TCP","66","[TCP Keep-Alive ACK] 443  >  52798 [ACK] Seq=1 Ack=2 Win=123 Len=0 SLE=1 SRE=2"
"60","16.580204","52.35.85.60","192.168.43.93","TCP","66","443  >  52805 [SYN, ACK] Seq=0 Ack=1 Win=26883 Len=0 MSS=1380 WS=256 SACK_PERM=1"
"61","16.580407","192.168.43.93","52.35.85.60","TCP","54","52805  >  443 [ACK] Seq=1 Ack=1 Win=66048 Len=0"
"62","16.587477","52.114.88.28","192.168.43.93","TCP","1434","443  >  52804 [ACK] Seq=1 Ack=209 Win=262144 Len=1380 [TCP segment of a reassembled PDU]"
"63","16.596725","192.168.43.93","52.35.85.60","TLSv1.2","571","Client Hello"
"64","16.598507","52.114.88.28","192.168.43.93","TCP","1434","443  >  52804 [ACK] Seq=1381 Ack=209 Win=262144 Len=1380 [TCP segment of a reassembled PDU]"
"65","16.598603","192.168.43.93","52.114.88.28","TCP","54","52804  >  443 [ACK] Seq=209 Ack=2761 Win=66048 Len=0"
"66","16.604552","52.114.88.28","192.168.43.93","TLSv1.2","1295","Server Hello, Certificate, Server Key Exchange, Server Hello Done"
"67","16.604552","52.35.85.60","192.168.43.93","TCP","58","443  >  52806 [SYN, ACK] Seq=0 Ack=1 Win=26883 Len=0 MSS=1380"
"68","16.604804","192.168.43.93","52.35.85.60","TCP","54","52806  >  443 [ACK] Seq=1 Ack=1 Win=64240 Len=0"
"69","16.610737","192.168.43.93","52.35.85.60","TLSv1.2","571","Client Hello"
"70","16.613220","192.168.43.93","52.114.88.28","TLSv1.2","147","Client Key Exchange, Change Cipher Spec, Encrypted Handshake Message"
"71","16.875550","52.35.85.60","192.168.43.93","TCP","54","443  >  52805 [ACK] Seq=1 Ack=518 Win=28160 Len=0"
"72","16.876089","52.35.85.60","192.168.43.93","TLSv1.2","1434","Server Hello"
"73","16.876089","52.35.85.60","192.168.43.93","TCP","1434","443  >  52805 [ACK] Seq=1381 Ack=518 Win=28160 Len=1380 [TCP segment of a reassembled PDU]"
"74","16.876301","192.168.43.93","52.35.85.60","TCP","54","52805  >  443 [ACK] Seq=518 Ack=2761 Win=66048 Len=0"
"75","16.877021","52.35.85.60","192.168.43.93","TLSv1.2","712","Certificate, Server Key Exchange, Server Hello Done"
"76","16.891183","52.35.85.60","192.168.43.93","TCP","54","443  >  52806 [ACK] Seq=1 Ack=518 Win=26800 Len=0"
"77","16.891183","52.35.85.60","192.168.43.93","TLSv1.2","1354","Server Hello"
"78","16.891183","52.35.85.60","192.168.43.93","TCP","1354","443  >  52806 [ACK] Seq=1301 Ack=518 Win=26800 Len=1300 [TCP segment of a reassembled PDU]"
"79","16.891183","52.35.85.60","192.168.43.93","TLSv1.2","872","Certificate, Server Key Exchange, Server Hello Done"
"80","16.891183","52.114.88.28","192.168.43.93","TLSv1.2","105","Change Cipher Spec, Encrypted Handshake Message"
"81","16.891437","192.168.43.93","52.35.85.60","TCP","54","52806  >  443 [ACK] Seq=518 Ack=3419 Win=64860 Len=0"
"82","16.897010","192.168.43.93","52.35.85.60","TLSv1.2","180","Client Key Exchange, Change Cipher Spec, Encrypted Handshake Message"
"83","16.914220","69.171.250.60","192.168.43.93","TLSv1.2","230","Application Data"
"84","16.928611","192.168.43.93","52.35.85.60","TLSv1.2","180","Client Key Exchange, Change Cipher Spec, Encrypted Handshake Message"
"85","16.931208","192.168.43.93","52.114.88.28","TLSv1.2","1025","Application Data"
"86","16.931835","192.168.43.93","52.35.85.60","TLSv1.2","607","Application Data"
"87","16.932538","192.168.43.93","52.35.85.60","TCP","54","52806  >  443 [FIN, ACK] Seq=644 Ack=3419 Win=64860 Len=0"
"88","16.936669","192.168.43.93","52.114.88.28","TCP","1434","52804  >  443 [ACK] Seq=1273 Ack=4053 Win=64768 Len=1380 [TCP segment of a reassembled PDU]"
"89","16.936669","192.168.43.93","52.114.88.28","TCP","1434","52804  >  443 [ACK] Seq=2653 Ack=4053 Win=64768 Len=1380 [TCP segment of a reassembled PDU]"
"90","16.936669","192.168.43.93","52.114.88.28","TCP","1434","52804  >  443 [ACK] Seq=4033 Ack=4053 Win=64768 Len=1380 [TCP segment of a reassembled PDU]"
"91","16.942850","69.171.250.60","192.168.43.93","TLSv1.2","337","Application Data"
"92","16.942977","192.168.43.93","69.171.250.60","TCP","54","52766  >  443 [ACK] Seq=32 Ack=498 Win=2076 Len=0"
"93","17.174302","52.35.85.60","192.168.43.93","TLSv1.2","105","Change Cipher Spec, Encrypted Handshake Message"
"94","17.202950","52.35.85.60","192.168.43.93","TLSv1.2","105","Change Cipher Spec, Encrypted Handshake Message"
"95","17.203133","192.168.43.93","52.35.85.60","TCP","54","52806  >  443 [RST, ACK] Seq=645 Ack=3470 Win=0 Len=0"
"96","17.211029","52.114.88.28","192.168.43.93","TCP","54","443  >  52804 [ACK] Seq=4053 Ack=2653 Win=262144 Len=0"
"97","17.211029","52.35.85.60","192.168.43.93","TLSv1.2","85","Encrypted Alert"
"98","17.211166","192.168.43.93","52.114.88.28","TLSv1.2","1156","Application Data"
"99","17.211447","52.35.85.60","192.168.43.93","TCP","54","443  >  52806 [FIN, ACK] Seq=3501 Ack=645 Win=26800 Len=0"
"100","17.215201","192.168.43.93","52.35.85.60","TCP","54","52805  >  443 [ACK] Seq=1197 Ack=3470 Win=65280 Len=0"
"101","17.218780","52.35.85.60","192.168.43.93","TLSv1.2","212","Application Data"
"102","17.234607","192.168.43.93","52.35.85.60","TLSv1.2","200","Application Data"
"103","17.242610","52.114.88.28","192.168.43.93","TCP","54","443  >  52804 [ACK] Seq=4053 Ack=5413 Win=262144 Len=0"
"104","17.515006","52.35.85.60","192.168.43.93","TLSv1.2","253","Application Data"
"105","17.515270","52.114.88.28","192.168.43.93","TLSv1.2","412","Application Data"
"106","17.543508","192.168.43.93","52.114.88.28","TCP","54","52804  >  443 [FIN, ACK] Seq=6515 Ack=4411 Win=66048 Len=0"
"107","17.559407","192.168.43.93","52.35.85.60","TCP","54","52805  >  443 [ACK] Seq=1343 Ack=3827 Win=65024 Len=0"
"108","17.562788","192.168.43.93","192.168.43.1","DNS","97","Standard query 0xb6b9 A firefox.settings.services.mozilla.com"
"109","17.630855","192.168.43.1","192.168.43.93","DNS","298","Standard query response 0xb6b9 A firefox.settings.services.mozilla.com A 204.246.164.67 A 204.246.164.21 A 204.246.164.29 A 204.246.164.18 NS ns-1364.awsdns-42.org NS ns-1627.awsdns-11.co.uk NS ns-166.awsdns-20.com NS ns-972.awsdns-57.net"
"110","17.632825","192.168.43.93","204.246.164.67","TCP","66","52807  >  443 [SYN] Seq=0 Win=64240 Len=0 MSS=1460 WS=256 SACK_PERM=1"
"111","17.634307","192.168.43.93","192.168.43.1","DNS","97","Standard query 0x4eb9 A firefox.settings.services.mozilla.com"
"112","17.642540","192.168.43.1","192.168.43.93","DNS","161","Standard query response 0x4eb9 A firefox.settings.services.mozilla.com A 204.246.164.18 A 204.246.164.29 A 204.246.164.21 A 204.246.164.67"
"113","17.644100","192.168.43.93","192.168.43.1","DNS","97","Standard query 0xec2a AAAA firefox.settings.services.mozilla.com"
"114","17.720901","204.246.164.67","192.168.43.93","TCP","66","443  >  52807 [SYN, ACK] Seq=0 Ack=1 Win=29200 Len=0 MSS=1380 WS=256 SACK_PERM=1"
"115","17.721112","192.168.43.93","204.246.164.67","TCP","54","52807  >  443 [ACK] Seq=1 Ack=1 Win=66048 Len=0"
"116","17.732287","192.168.43.1","192.168.43.93","DNS","181","Standard query response 0xec2a AAAA firefox.settings.services.mozilla.com SOA ns-1627.awsdns-11.co.uk"
"117","17.737516","192.168.43.93","204.246.164.67","TLSv1.3","571","Client Hello"
"118","17.830055","52.114.88.28","192.168.43.93","TCP","54","443  >  52804 [FIN, ACK] Seq=4411 Ack=6516 Win=260864 Len=0"
"119","17.830417","192.168.43.93","52.114.88.28","TCP","54","52804  >  443 [ACK] Seq=6516 Ack=4412 Win=66048 Len=0"
"120","17.873483","204.246.164.67","192.168.43.93","TCP","54","443  >  52807 [ACK] Seq=1 Ack=518 Win=30464 Len=0"
"121","17.888104","204.246.164.67","192.168.43.93","TLSv1.3","1434","Server Hello, Change Cipher Spec, Application Data"
"122","17.894313","204.246.164.67","192.168.43.93","TCP","1434","443  >  52807 [ACK] Seq=1381 Ack=518 Win=30464 Len=1380 [TCP segment of a reassembled PDU]"
"123","17.894313","204.246.164.67","192.168.43.93","TLSv1.3","1273","Application Data, Application Data, Application Data"
"124","17.894487","192.168.43.93","204.246.164.67","TCP","54","52807  >  443 [ACK] Seq=518 Ack=3980 Win=66048 Len=0"
"125","17.904686","192.168.43.93","204.246.164.67","TLSv1.3","118","Change Cipher Spec, Application Data"
"126","17.908040","192.168.43.93","204.246.164.67","TLSv1.3","413","Application Data"
"127","17.984711","204.246.164.67","192.168.43.93","TCP","54","443  >  52807 [ACK] Seq=3980 Ack=582 Win=30464 Len=0"
"128","17.997615","204.246.164.67","192.168.43.93","TCP","54","443  >  52807 [ACK] Seq=3980 Ack=941 Win=31488 Len=0"
"129","18.002725","204.246.164.67","192.168.43.93","TCP","1434","443  >  52807 [ACK] Seq=3980 Ack=941 Win=31488 Len=1380 [TCP segment of a reassembled PDU]"
"130","18.008819","204.246.164.67","192.168.43.93","TCP","1434","443  >  52807 [ACK] Seq=5360 Ack=941 Win=31488 Len=1380 [TCP segment of a reassembled PDU]"
"131","18.008988","192.168.43.93","204.246.164.67","TCP","54","52807  >  443 [ACK] Seq=941 Ack=6740 Win=66048 Len=0"
"132","18.021833","204.246.164.67","192.168.43.93","TCP","1434","443  >  52807 [ACK] Seq=6740 Ack=941 Win=31488 Len=1380 [TCP segment of a reassembled PDU]"
"133","18.021833","204.246.164.67","192.168.43.93","TCP","1434","443  >  52807 [ACK] Seq=8120 Ack=941 Win=31488 Len=1380 [TCP segment of a reassembled PDU]"
"134","18.022042","192.168.43.93","204.246.164.67","TCP","54","52807  >  443 [ACK] Seq=941 Ack=9500 Win=66048 Len=0"
"135","18.026799","204.246.164.67","192.168.43.93","TCP","1434","443  >  52807 [ACK] Seq=9500 Ack=941 Win=31488 Len=1380 [TCP segment of a reassembled PDU]"
"136","18.027813","204.246.164.67","192.168.43.93","TCP","1434","443  >  52807 [ACK] Seq=10880 Ack=941 Win=31488 Len=1380 [TCP segment of a reassembled PDU]"
"137","18.027813","204.246.164.67","192.168.43.93","TCP","1434","443  >  52807 [ACK] Seq=12260 Ack=941 Win=31488 Len=1380 [TCP segment of a reassembled PDU]"
"138","18.027813","204.246.164.67","192.168.43.93","TCP","1434","443  >  52807 [ACK] Seq=13640 Ack=941 Win=31488 Len=1380 [TCP segment of a reassembled PDU]"
"139","18.027948","192.168.43.93","204.246.164.67","TCP","54","52807  >  443 [ACK] Seq=941 Ack=15020 Win=66048 Len=0"
"140","18.042731","204.246.164.67","192.168.43.93","TCP","1434","443  >  52807 [ACK] Seq=15020 Ack=941 Win=31488 Len=1380 [TCP segment of a reassembled PDU]"
"141","18.048721","204.246.164.67","192.168.43.93","TCP","1434","443  >  52807 [ACK] Seq=16400 Ack=941 Win=31488 Len=1380 [TCP segment of a reassembled PDU]"
"142","18.048834","192.168.43.93","204.246.164.67","TCP","54","52807  >  443 [ACK] Seq=941 Ack=17780 Win=66048 Len=0"
"143","18.049754","204.246.164.67","192.168.43.93","TCP","1434","443  >  52807 [ACK] Seq=17780 Ack=941 Win=31488 Len=1380 [TCP segment of a reassembled PDU]"
"144","18.049754","204.246.164.67","192.168.43.93","TLSv1.3","1434","Application Data [TCP segment of a reassembled PDU]"
"145","18.049754","204.246.164.67","192.168.43.93","TCP","1434","443  >  52807 [ACK] Seq=20540 Ack=941 Win=31488 Len=1380 [TCP segment of a reassembled PDU]"
"146","18.049754","204.246.164.67","192.168.43.93","TLSv1.3","70","Application Data"
"147","18.049843","192.168.43.93","204.246.164.67","TCP","54","52807  >  443 [ACK] Seq=941 Ack=21936 Win=66048 Len=0"
"148","18.196961","192.168.43.93","204.246.164.67","TLSv1.3","497","Application Data"
"149","18.307995","204.246.164.67","192.168.43.93","TCP","1434","443  >  52807 [ACK] Seq=21936 Ack=1384 Win=32512 Len=1380 [TCP segment of a reassembled PDU]"
"150","18.308177","204.246.164.67","192.168.43.93","TLSv1.3","645","Application Data"
"151","18.308225","192.168.43.93","204.246.164.67","TCP","54","52807  >  443 [ACK] Seq=1384 Ack=23907 Win=66048 Len=0"
"152","18.421253","192.168.43.93","192.168.43.1","DNS","95","Standard query 0xf36d A content-signature-2.cdn.mozilla.net"
"153","18.466014","192.168.43.93","204.246.164.76","TLSv1.2","220","Application Data"
"154","18.496310","192.168.43.1","192.168.43.93","DNS","336","Standard query response 0xf36d A content-signature-2.cdn.mozilla.net CNAME d2nxq2uap88usk.cloudfront.net A 204.246.164.76 A 204.246.164.111 A 204.246.164.33 A 204.246.164.19 NS ns-1295.awsdns-33.org NS ns-1811.awsdns-34.co.uk NS ns-365.awsdns-45.com NS ns-704.awsdns-24.net"
"155","18.497969","192.168.43.93","192.168.43.1","DNS","89","Standard query 0x08ee A d2nxq2uap88usk.cloudfront.net"
"156","18.500310","192.168.43.1","192.168.43.93","DNS","153","Standard query response 0x08ee A d2nxq2uap88usk.cloudfront.net A 204.246.164.19 A 204.246.164.33 A 204.246.164.111 A 204.246.164.76"
"157","18.501708","192.168.43.93","192.168.43.1","DNS","89","Standard query 0xd90b AAAA d2nxq2uap88usk.cloudfront.net"
"158","18.553111","204.246.164.76","192.168.43.93","TLSv1.2","374","Application Data"
"159","18.593774","192.168.43.93","204.246.164.76","TCP","54","52801  >  443 [ACK] Seq=167 Ack=321 Win=257 Len=0"
"160","18.672040","192.168.43.93","204.246.164.76","TLSv1.2","93","Application Data"
"161","18.672405","192.168.43.93","34.98.75.36","TLSv1.2","93","Application Data"
"162","18.672685","192.168.43.93","69.171.250.60","TLSv1.2","93","Application Data"
"163","18.673007","192.168.43.93","204.246.164.67","TLSv1.3","78","Application Data"
"164","18.673089","192.168.43.93","204.246.164.67","TCP","54","52807  >  443 [FIN, ACK] Seq=1408 Ack=23907 Win=66048 Len=0"
"165","18.673415","192.168.43.93","117.18.237.29","TCP","54","52800  >  80 [FIN, ACK] Seq=2 Ack=1 Win=255 Len=0"
"166","18.674246","192.168.43.93","204.246.164.117","SSL","78","Continuation Data"
"167","18.674398","192.168.43.93","204.246.164.117","TCP","54","52798  >  443 [FIN, ACK] Seq=26 Ack=1 Win=258 Len=0"
"168","18.674776","192.168.43.93","23.219.184.16","TCP","54","52759  >  80 [FIN, ACK] Seq=1 Ack=1 Win=255 Len=0"
"169","18.675022","192.168.43.93","23.219.184.35","TCP","54","52758  >  80 [FIN, ACK] Seq=1 Ack=1 Win=258 Len=0"
"170","18.676017","192.168.43.93","69.171.250.60","TLSv1.2","78","Application Data"
"171","18.676160","192.168.43.93","69.171.250.60","TCP","54","52764  >  443 [FIN, ACK] Seq=103 Ack=40 Win=255 Len=0"
"172","18.677039","192.168.43.93","204.246.164.76","TLSv1.2","78","Application Data"
"173","18.677147","192.168.43.93","204.246.164.76","TCP","54","52801  >  443 [FIN, ACK] Seq=230 Ack=321 Win=257 Len=0"
"174","18.678070","192.168.43.93","34.98.75.36","TLSv1.2","78","Application Data"
"175","18.678226","192.168.43.93","34.98.75.36","TCP","54","52799  >  443 [FIN, ACK] Seq=64 Ack=1 Win=255 Len=0"
"176","18.690245","192.168.43.93","192.168.43.1","DNS","89","Standard query 0xd90b AAAA d2nxq2uap88usk.cloudfront.net"
"177","18.973185","192.168.43.93","204.246.164.76","TCP","117","[TCP Retransmission] 52801  >  443 [FIN, PSH, ACK] Seq=167 Ack=321 Win=257 Len=63"
"178","18.973319","192.168.43.93","34.98.75.36","TCP","117","[TCP Retransmission] 52799  >  443 [FIN, PSH, ACK] Seq=1 Ack=1 Win=255 Len=63"
"179","18.973365","192.168.43.93","204.246.164.67","TCP","78","[TCP Retransmission] 52807  >  443 [FIN, PSH, ACK] Seq=1384 Ack=23907 Win=66048 Len=24"
"180","18.974272","192.168.43.93","204.246.164.117","TCP","78","[TCP Retransmission] 52798  >  443 [FIN, PSH, ACK] Seq=2 Ack=1 Win=258 Len=24"
"181","19.026111","192.168.43.93","69.171.250.60","TCP","117","[TCP Retransmission] 52764  >  443 [FIN, PSH, ACK] Seq=40 Ack=40 Win=255 Len=63"
"182","19.202884","192.168.43.93","23.219.184.35","TCP","54","[TCP Retransmission] 52758  >  80 [FIN, ACK] Seq=1 Ack=1 Win=258 Len=0"
"183","19.211816","192.168.43.93","117.18.237.29","TCP","54","[TCP Retransmission] 52800  >  80 [FIN, ACK] Seq=2 Ack=1 Win=255 Len=0"
"184","19.273730","192.168.43.93","204.246.164.76","TCP","117","[TCP Retransmission] 52801  >  443 [FIN, PSH, ACK] Seq=167 Ack=321 Win=257 Len=63"
"185","19.273856","192.168.43.93","34.98.75.36","TCP","117","[TCP Retransmission] 52799  >  443 [FIN, PSH, ACK] Seq=1 Ack=1 Win=255 Len=63"
"186","19.273904","192.168.43.93","204.246.164.67","TCP","78","[TCP Retransmission] 52807  >  443 [FIN, PSH, ACK] Seq=1384 Ack=23907 Win=66048 Len=24"
"187","19.276832","192.168.43.93","204.246.164.117","TCP","78","[TCP Retransmission] 52798  >  443 [FIN, PSH, ACK] Seq=2 Ack=1 Win=258 Len=24"
"188","19.419549","192.168.43.93","69.171.250.60","TCP","117","[TCP Retransmission] 52764  >  443 [FIN, PSH, ACK] Seq=40 Ack=40 Win=255 Len=63"
"189","19.660534","192.168.43.1","192.168.43.93","DNS","450","Standard query response 0xd90b AAAA d2nxq2uap88usk.cloudfront.net AAAA 2600:9000:2003:8e00:a:da5e:7900:93a1 AAAA 2600:9000:2003:ba00:a:da5e:7900:93a1 AAAA 2600:9000:2003:3200:a:da5e:7900:93a1 AAAA 2600:9000:2003:2400:a:da5e:7900:93a1 AAAA 2600:9000:2003:7a00:a:da5e:7900:93a1 AAAA 2600:9000:2003:2600:a:da5e:7900:93a1 AAAA 2600:9000:2003:1e00:a:da5e:7900:93a1 AAAA 2600:9000:2003:4e00:a:da5e:7900:93a1 NS ns-1295.awsdns-33.org NS ns-1811.awsdns-34.co.uk NS ns-365.awsdns-45.com NS ns-704.awsdns-24.net"
"190","19.660534","204.246.164.76","192.168.43.93","TLSv1.2","374","[TCP Spurious Retransmission] , Application Data"
"191","19.660691","192.168.43.93","204.246.164.76","TCP","66","[TCP Dup ACK 159#1] 52801  >  443 [ACK] Seq=231 Ack=321 Win=257 Len=0 SLE=1 SRE=321"
"192","19.661434","204.246.164.76","192.168.43.93","TLSv1.2","374","[TCP Spurious Retransmission] , Application Data"
"193","19.661522","192.168.43.93","204.246.164.76","TCP","66","[TCP Dup ACK 159#2] 52801  >  443 [ACK] Seq=231 Ack=321 Win=257 Len=0 SLE=1 SRE=321"
"194","19.663347","192.168.43.1","192.168.43.93","DNS","313","Standard query response 0xd90b AAAA d2nxq2uap88usk.cloudfront.net AAAA 2600:9000:2003:4e00:a:da5e:7900:93a1 AAAA 2600:9000:2003:1e00:a:da5e:7900:93a1 AAAA 2600:9000:2003:2600:a:da5e:7900:93a1 AAAA 2600:9000:2003:7a00:a:da5e:7900:93a1 AAAA 2600:9000:2003:2400:a:da5e:7900:93a1 AAAA 2600:9000:2003:3200:a:da5e:7900:93a1 AAAA 2600:9000:2003:ba00:a:da5e:7900:93a1 AAAA 2600:9000:2003:8e00:a:da5e:7900:93a1"
"195","19.773505","204.246.164.117","192.168.43.93","TCP","66","[TCP Dup ACK 4#1] 443  >  52798 [ACK] Seq=1 Ack=2 Win=123 Len=0 SLE=26 SRE=27"
"196","19.773505","204.246.164.67","192.168.43.93","TCP","66","[TCP Dup ACK 149#1] 443  >  52807 [ACK] Seq=23907 Ack=1384 Win=32512 Len=0 SLE=1408 SRE=1409"
"197","19.778339","204.246.164.67","192.168.43.93","TCP","54","443  >  52807 [ACK] Seq=23907 Ack=1409 Win=32512 Len=0"
"198","19.781190","204.246.164.67","192.168.43.93","TCP","54","443  >  52807 [FIN, ACK] Seq=23907 Ack=1409 Win=32512 Len=0"
"199","19.781190","204.246.164.76","192.168.43.93","TCP","66","[TCP Dup ACK 158#1] 443  >  52801 [ACK] Seq=321 Ack=167 Win=345 Len=0 SLE=230 SRE=231"
"200","19.781190","204.246.164.117","192.168.43.93","TCP","54","443  >  52798 [ACK] Seq=1 Ack=27 Win=123 Len=0"
"201","19.781190","204.246.164.117","192.168.43.93","TCP","54","443  >  52798 [FIN, ACK] Seq=1 Ack=27 Win=123 Len=0"
"202","19.781190","204.246.164.76","192.168.43.93","TCP","66","443  >  52801 [ACK] Seq=321 Ack=206 Win=345 Len=0 SLE=230 SRE=231"
"203","19.781190","23.219.184.16","192.168.43.93","TCP","54","80  >  52759 [FIN, ACK] Seq=1 Ack=2 Win=245 Len=0"
"204","19.781305","192.168.43.93","204.246.164.67","TCP","54","52807  >  443 [ACK] Seq=1409 Ack=23908 Win=66048 Len=0"
"205","19.781540","192.168.43.93","204.246.164.117","TCP","54","52798  >  443 [ACK] Seq=27 Ack=2 Win=258 Len=0"
"206","19.781683","192.168.43.93","23.219.184.16","TCP","54","52759  >  80 [ACK] Seq=2 Ack=2 Win=255 Len=0"
"207","19.783338","23.219.184.35","192.168.43.93","TCP","66","80  >  52758 [ACK] Seq=1 Ack=2 Win=262 Len=0 SLE=1 SRE=2"
"208","19.783944","34.98.75.36","192.168.43.93","TCP","66","443  >  52799 [ACK] Seq=1 Ack=1 Win=269 Len=0 SLE=64 SRE=65"
"209","19.783944","23.219.184.35","192.168.43.93","TCP","54","80  >  52758 [FIN, ACK] Seq=1 Ack=2 Win=262 Len=0"
"210","19.783944","69.171.250.60","192.168.43.93","TCP","66","[TCP Dup ACK 8#1] 443  >  52764 [ACK] Seq=40 Ack=40 Win=281 Len=0 SLE=103 SRE=104"
"211","19.784120","192.168.43.93","23.219.184.35","TCP","54","52758  >  80 [ACK] Seq=2 Ack=2 Win=258 Len=0"
"212","19.784333","204.246.164.76","192.168.43.93","TCP","54","443  >  52801 [ACK] Seq=321 Ack=231 Win=345 Len=0"
"213","19.784333","204.246.164.76","192.168.43.93","TCP","54","443  >  52801 [FIN, ACK] Seq=321 Ack=231 Win=345 Len=0"
"214","19.784387","192.168.43.93","204.246.164.76","TCP","54","52801  >  443 [ACK] Seq=231 Ack=322 Win=257 Len=0"
"215","19.790187","34.98.75.36","192.168.43.93","TCP","66","443  >  52799 [ACK] Seq=1 Ack=40 Win=269 Len=0 SLE=64 SRE=65"
"216","19.795992","69.171.250.60","192.168.43.93","TCP","66","443  >  52764 [ACK] Seq=40 Ack=79 Win=281 Len=0 SLE=103 SRE=104"
"217","19.796263","69.171.250.60","192.168.43.93","TLSv1.2","105","Application Data"
"218","19.796436","192.168.43.93","69.171.250.60","TCP","54","52764  >  443 [RST, ACK] Seq=104 Ack=79 Win=0 Len=0"
"219","19.796735","69.171.250.60","192.168.43.93","TCP","66","443  >  52764 [FIN, ACK] Seq=79 Ack=79 Win=281 Len=0 SLE=103 SRE=104"
"220","19.796735","69.171.250.60","192.168.43.93","TCP","54","443  >  52764 [RST] Seq=40 Win=0 Len=0"
"221","19.801514","204.246.164.76","192.168.43.93","TCP","66","[TCP Dup ACK 212#1] 443  >  52801 [ACK] Seq=322 Ack=231 Win=345 Len=0 SLE=167 SRE=231"
"222","19.801809","204.246.164.76","192.168.43.93","TCP","66","[TCP Dup ACK 212#2] 443  >  52801 [ACK] Seq=322 Ack=231 Win=345 Len=0 SLE=167 SRE=231"
"223","19.813949","34.98.75.36","192.168.43.93","TCP","54","443  >  52799 [ACK] Seq=1 Ack=65 Win=269 Len=0"
"224","19.814146","34.98.75.36","192.168.43.93","TCP","66","[TCP Dup ACK 223#1] 443  >  52799 [ACK] Seq=1 Ack=65 Win=269 Len=0 SLE=1 SRE=65"
"225","19.814146","34.98.75.36","192.168.43.93","TCP","54","443  >  52799 [FIN, ACK] Seq=1 Ack=65 Win=269 Len=0"
"226","19.814146","34.98.75.36","192.168.43.93","TCP","66","[TCP Dup ACK 223#2] 443  >  52799 [ACK] Seq=2 Ack=65 Win=269 Len=0 SLE=1 SRE=65"
"227","19.814253","192.168.43.93","34.98.75.36","TCP","54","52799  >  443 [ACK] Seq=65 Ack=2 Win=255 Len=0"
"228","19.857534","117.18.237.29","192.168.43.93","TCP","54","80  >  52800 [FIN, ACK] Seq=1 Ack=3 Win=131 Len=0"
"229","19.857703","192.168.43.93","117.18.237.29","TCP","54","52800  >  80 [ACK] Seq=3 Ack=2 Win=255 Len=0"
"230","19.861948","117.18.237.29","192.168.43.93","TCP","66","[TCP Dup ACK 228#1] 80  >  52800 [ACK] Seq=2 Ack=3 Win=131 Len=0 SLE=2 SRE=3"
"231","24.969331","192.168.43.93","40.90.23.206","TCP","54","52791  >  443 [FIN, ACK] Seq=1 Ack=1 Win=258 Len=0"
"232","25.708968","192.168.43.93","40.90.23.206","TCP","54","[TCP Retransmission] 52791  >  443 [FIN, ACK] Seq=1 Ack=1 Win=258 Len=0"
"233","26.117986","40.90.23.206","192.168.43.93","TCP","54","443  >  52791 [FIN, ACK] Seq=1 Ack=2 Win=1024 Len=0"
"234","26.118122","192.168.43.93","40.90.23.206","TCP","54","52791  >  443 [ACK] Seq=2 Ack=2 Win=258 Len=0"
"235","26.120833","40.90.23.206","192.168.43.93","TCP","54","[TCP Dup ACK 233#1] 443  >  52791 [ACK] Seq=2 Ack=2 Win=1024 Len=0"
"236","31.048694","HonHaiPr_22:9d:1b","RealmeCh_44:52:99","ARP","42","Who has 192.168.43.1? Tell 192.168.43.93"
"237","31.356779","192.168.43.93","58.251.106.185","TCP","66","52808  >  443 [SYN] Seq=0 Win=65535 Len=0 MSS=1460 WS=2 SACK_PERM=1"
"238","32.048946","HonHaiPr_22:9d:1b","RealmeCh_44:52:99","ARP","42","Who has 192.168.43.1? Tell 192.168.43.93"
"239","32.069914","RealmeCh_44:52:99","HonHaiPr_22:9d:1b","ARP","42","Who has 192.168.43.93? Tell 192.168.43.1"
"240","32.069959","HonHaiPr_22:9d:1b","RealmeCh_44:52:99","ARP","42","192.168.43.93 is at 9c:30:5b:22:9d:1b"
"241","32.071925","RealmeCh_44:52:99","HonHaiPr_22:9d:1b","ARP","42","192.168.43.1 is at 44:46:87:44:52:99"
"242","32.073341","RealmeCh_44:52:99","HonHaiPr_22:9d:1b","ARP","42","192.168.43.1 is at 44:46:87:44:52:99"
"243","32.357575","192.168.43.93","58.251.106.185","TCP","66","[TCP Retransmission] 52808  >  443 [SYN] Seq=0 Win=65535 Len=0 MSS=1460 WS=2 SACK_PERM=1"
"244","32.603231","58.251.106.185","192.168.43.93","TCP","66","443  >  52808 [SYN, ACK] Seq=0 Ack=1 Win=13600 Len=0 MSS=1360 WS=1024 SACK_PERM=1"
"245","32.603423","192.168.43.93","58.251.106.185","TCP","54","52808  >  443 [ACK] Seq=1 Ack=1 Win=65536 Len=0"
"246","32.618195","192.168.43.93","58.251.106.185","TCP","336","52808  >  443 [PSH, ACK] Seq=1 Ack=1 Win=65536 Len=282 [TCP segment of a reassembled PDU]"
"247","33.447826","192.168.43.93","69.171.250.60","TLSv1.2","141","Application Data"
"248","33.475567","192.168.43.93","69.171.250.60","TLSv1.2","140","Application Data"
"249","33.490078","192.168.43.93","192.168.43.1","DNS","76","Standard query 0xb443 A web.whatsapp.com"
"250","33.545904","69.171.250.60","192.168.43.93","TCP","54","443  >  52766 [ACK] Seq=498 Ack=119 Win=260 Len=0"
"251","33.556886","192.168.43.1","192.168.43.93","DNS","129","Standard query response 0xb443 A web.whatsapp.com CNAME mmx-ds.cdn.whatsapp.net A 69.171.250.60"
"252","33.558698","192.168.43.93","192.168.43.1","DNS","83","Standard query 0x7d17 A mmx-ds.cdn.whatsapp.net"
"253","33.563109","192.168.43.1","192.168.43.93","DNS","99","Standard query response 0x7d17 A mmx-ds.cdn.whatsapp.net A 69.171.250.60"
"254","33.564561","192.168.43.93","192.168.43.1","DNS","83","Standard query 0x0931 AAAA mmx-ds.cdn.whatsapp.net"
"255","33.572727","69.171.250.60","192.168.43.93","TCP","54","443  >  52766 [ACK] Seq=498 Ack=205 Win=260 Len=0"
"256","33.612049","192.168.43.93","69.171.250.60","TLSv1.2","151","Application Data"
"257","33.636924","192.168.43.1","192.168.43.93","DNS","111","Standard query response 0x0931 AAAA mmx-ds.cdn.whatsapp.net AAAA 2a03:2880:f2ff:c0:face:b00c:0:167"
"258","33.668226","192.168.43.93","69.171.250.60","TLSv1.2","141","Application Data"
"259","33.721717","69.171.250.60","192.168.43.93","TCP","54","443  >  52766 [ACK] Seq=498 Ack=302 Win=260 Len=0"
"260","33.753688","69.171.250.60","192.168.43.93","TLSv1.2","87","Application Data"
"261","33.780657","192.168.43.93","69.171.250.60","TLSv1.2","151","Application Data"
"262","33.781060","192.168.43.93","69.171.250.60","TLSv1.2","140","Application Data"
"263","33.797201","69.171.250.60","192.168.43.93","TLSv1.2","87","Application Data"
"264","33.797201","69.171.250.60","192.168.43.93","TLSv1.2","258","Application Data"
"265","33.797340","192.168.43.93","69.171.250.60","TCP","54","52766  >  443 [ACK] Seq=572 Ack=768 Win=2080 Len=0"
"266","33.830834","192.168.43.93","69.171.250.60","TLSv1.2","151","Application Data"
"267","33.853182","69.171.250.60","192.168.43.93","TLSv1.2","258","Application Data"
"268","33.891302","69.171.250.60","192.168.43.93","TCP","54","443  >  52766 [ACK] Seq=972 Ack=572 Win=260 Len=0"
"269","33.893544","192.168.43.93","69.171.250.60","TCP","54","52766  >  443 [ACK] Seq=669 Ack=972 Win=2079 Len=0"
"270","33.924315","69.171.250.60","192.168.43.93","TLSv1.2","87","Application Data"
"271","33.958362","192.168.43.93","69.171.250.60","TLSv1.2","149","Application Data"
"272","33.967520","192.168.43.93","69.171.250.60","TLSv1.2","149","Application Data"
"273","33.983322","69.171.250.60","192.168.43.93","TLSv1.2","87","Application Data"
"274","34.023968","192.168.43.93","69.171.250.60","TCP","54","52766  >  443 [ACK] Seq=859 Ack=1038 Win=2079 Len=0"
"275","34.057260","69.171.250.60","192.168.43.93","TLSv1.2","257","Application Data"
"276","34.057260","69.171.250.60","192.168.43.93","TLSv1.2","258","Application Data"
"277","34.057397","192.168.43.93","69.171.250.60","TCP","54","52766  >  443 [ACK] Seq=859 Ack=1445 Win=2078 Len=0"
"278","34.089021","69.171.250.60","192.168.43.93","TCP","54","443  >  52766 [ACK] Seq=1445 Ack=859 Win=260 Len=0"
"279","34.096159","69.171.250.60","192.168.43.93","TLSv1.2","87","Application Data"
"280","34.096159","69.171.250.60","192.168.43.93","TLSv1.2","87","Application Data"
"281","34.096280","192.168.43.93","69.171.250.60","TCP","54","52766  >  443 [ACK] Seq=859 Ack=1511 Win=2077 Len=0"
"282","34.142953","69.171.250.60","192.168.43.93","TLSv1.2","87","Application Data"
"283","34.155361","69.171.250.60","192.168.43.93","TLSv1.2","258","Application Data"
"284","34.155474","192.168.43.93","69.171.250.60","TCP","54","52766  >  443 [ACK] Seq=859 Ack=1748 Win=2076 Len=0"
"285","34.205844","69.171.250.60","192.168.43.93","TLSv1.2","257","Application Data"
"286","34.248557","192.168.43.93","69.171.250.60","TCP","54","52766  >  443 [ACK] Seq=859 Ack=1951 Win=2076 Len=0"
"287","34.288496","69.171.250.60","192.168.43.93","TLSv1.2","258","Application Data"
"288","34.294217","69.171.250.60","192.168.43.93","TLSv1.2","87","Application Data"
"289","34.294338","192.168.43.93","69.171.250.60","TCP","54","52766  >  443 [ACK] Seq=859 Ack=2188 Win=2080 Len=0"
"290","34.300836","69.171.250.60","192.168.43.93","TLSv1.2","87","Application Data"
"291","34.312508","69.171.250.60","192.168.43.93","TCP","1434","443  >  52766 [ACK] Seq=2221 Ack=859 Win=260 Len=1380 [TCP segment of a reassembled PDU]"
"292","34.312508","69.171.250.60","192.168.43.93","TLSv1.2","1434","Application Data [TCP segment of a reassembled PDU]"
"293","34.312648","192.168.43.93","69.171.250.60","TCP","54","52766  >  443 [ACK] Seq=859 Ack=4981 Win=2080 Len=0"
"294","34.374739","192.168.43.93","69.171.250.60","TLSv1.2","140","Application Data"
"295","34.400806","192.168.43.93","69.171.250.60","TLSv1.2","151","Application Data"
"296","34.439222","192.168.43.93","69.171.250.60","TLSv1.2","151","Application Data"
"297","34.483175","192.168.43.93","69.171.250.60","TLSv1.2","151","Application Data"
"298","34.545678","192.168.43.93","69.171.250.60","TLSv1.2","140","Application Data"
"299","34.603115","192.168.43.93","69.171.250.60","TLSv1.2","149","Application Data"
"300","34.610351","192.168.43.93","69.171.250.60","TLSv1.2","149","Application Data"
"301","34.842598","192.168.43.93","69.171.250.60","TCP","707","[TCP Retransmission] 52766  >  443 [PSH, ACK] Seq=859 Ack=4981 Win=2080 Len=653"
"302","35.157195","192.168.43.93","192.168.43.1","DNS","89","Standard query 0xcb1a A v10.events.data.microsoft.com"
"303","35.358879","192.168.43.93","192.168.43.1","DNS","89","Standard query 0xcb1a A v10.events.data.microsoft.com"
"304","35.443501","192.168.43.93","192.168.43.1","DNS","76","Standard query 0xd1a2 A pps.whatsapp.net"
"305","35.459900","192.168.43.93","69.171.250.60","TLSv1.2","84","Application Data"
"306","35.463658","69.171.250.60","192.168.43.93","TCP","1434","[TCP Previous segment not captured] 443  >  52766 [ACK] Seq=5541 Ack=859 Win=260 Len=1380 [TCP segment of a reassembled PDU]"
"307","35.463658","69.171.250.60","192.168.43.93","TLSv1.2","394","Application Data, Application Data"
"308","35.463658","69.171.250.60","192.168.43.93","TCP","394","[TCP Retransmission] 443  >  52766 [PSH, ACK] Seq=6921 Ack=859 Win=260 Len=340"
"309","35.463785","192.168.43.93","69.171.250.60","TCP","66","[TCP Dup ACK 293#1] 52766  >  443 [ACK] Seq=1542 Ack=4981 Win=2080 Len=0 SLE=5541 SRE=6921"
"310","35.463925","192.168.43.93","69.171.250.60","TCP","66","[TCP Dup ACK 293#2] 52766  >  443 [ACK] Seq=1542 Ack=4981 Win=2080 Len=0 SLE=5541 SRE=7261"
"311","35.463980","192.168.43.93","69.171.250.60","TCP","74","[TCP Dup ACK 293#3] 52766  >  443 [ACK] Seq=1542 Ack=4981 Win=2080 Len=0 SLE=6921 SRE=7261 SLE=5541 SRE=7261"
"312","35.464701","69.171.250.60","192.168.43.93","TLSv1.2","614","[TCP Fast Retransmission] , Application Data"
"313","35.464701","69.171.250.60","192.168.43.93","TCP","614","[TCP Fast Retransmission] 443  >  52766 [PSH, ACK] Seq=4981 Ack=859 Win=260 Len=560[Reassembly error, protocol TCP: New fragment overlaps old data (retransmission?)]"
"314","35.464814","192.168.43.93","69.171.250.60","TCP","54","52766  >  443 [ACK] Seq=1542 Ack=7261 Win=2080 Len=0"
"315","35.464930","192.168.43.93","69.171.250.60","TCP","66","[TCP Dup ACK 314#1] 52766  >  443 [ACK] Seq=1542 Ack=7261 Win=2080 Len=0 SLE=4981 SRE=5541"
"316","35.543594","192.168.43.93","69.171.250.60","TCP","737","[TCP Retransmission] 52766  >  443 [PSH, ACK] Seq=859 Ack=7261 Win=2080 Len=683"
"317","35.585106","192.168.43.1","192.168.43.93","DNS","117","Standard query response 0xd1a2 A pps.whatsapp.net CNAME mmx-ds.cdn.whatsapp.net A 69.171.250.60"
"318","35.588661","69.171.250.60","192.168.43.93","TCP","54","443  >  52766 [ACK] Seq=7261 Ack=1042 Win=260 Len=0"
"319","35.589898","192.168.43.1","192.168.43.93","DNS","207","Standard query response 0xcb1a A v10.events.data.microsoft.com CNAME global.asimov.events.data.trafficmanager.net CNAME skypedataprdcoluks04.cloudapp.net A 52.114.88.28"
"320","35.595812","69.171.250.60","192.168.43.93","TCP","54","443  >  52766 [ACK] Seq=7261 Ack=1236 Win=260 Len=0"
"321","35.605573","69.171.250.60","192.168.43.93","TCP","54","443  >  52766 [ACK] Seq=7261 Ack=1417 Win=260 Len=0"
